Date,Comments
"September 3, 2024","This is my second mac mouse. This one is smaller then the first one i had and really uncomfortable to hold.  I use the mouse all day and many times a day it won't track.  I tried everything, cleaning, turning bluetooth on and off.  Nothing works.  I am just going to get a 10$ mouse and hope it is better."
"August 14, 2024","Required full OS updates on M2 MacBook Air before full functionality was available (scrolling and swiping did not work until I updated). ""Auto"" connecting requires clicking the mouse before it will connect without going back into Bluetooth settings."
"August 7, 2024",It's too bad that even magic mice die.  Apple accessories are way overpriced but necessary.
"July 28, 2024",Plug n play. Excellent device.
"July 21, 2024","I like the fact that  it is made to do more than a traditional mouse.  It does take a minute to connect to the  computer.  I have found that if I turn it on first, it seems to connect faster."
"July 6, 2024","Connected to my new Mac Mini M4 lickity split. The new Mac knew I meant to pair it with this mouse, not the other Mac mouse 15 feet distant, paired with my M1 mini.So far, everything I'd expect from a magic mouse 2. I suspect it charges faster than my other (Lightening)  Mouse 2."
"June 26, 2024","Honestly it just feels weird to use, and it’s not exactly ergonomic."
"June 22, 2024","Based on the product information, the Apple Magic Mouse is designed to work with Mac computers and may have limited compatibility with non-Apple devices. It connects via Bluetooth and is optimized for use with macOS.frždrI was not able to use it.  I have Windows."
"April 26, 2024","On the positive side, buy the white one it works as well as the black one and is a lot cheaper!After using standard mice with batteries for years, I have a steep learning curve ahead of me. In fact when I use my MacBook sitting on the couch, I don’t use the mouse at all.I really can’t rate it properly until I have used it for some time. It feels good, looks good and coming from Apple should be fine until they produce another one every Apple lover needs to have🤑"
"February 27, 2024","The Magic Mouse is everything you’d expect from Apple—clean design and smooth functionality. The wireless connection is rock solid, and it pairs effortlessly with my Mac. The Multi-Touch surface is a game changer, making navigation feel intuitive and responsive. Plus, the rechargeable battery means no more digging for spare AA batteries. It’s a sleek addition to any setup, and it just works."
"October 22, 2023","If you have used one of these mice before then you don't really need a review. I'll just say it looks nice in black although it starts looking dirty slightly easier than the white one.If you haven't used this product before, these are some important considerations:a. It's the most Mac-compatible mouse that I know of, it being from the same company. So you'll have access to all the nice gestures and features. That is a huge plus if you're a fan of the MacOS interface.b. Its biggest flaw by far is the charging situation. The charging port is BELOW the mouse, making it physically impossible to charge the mouse WHILE using it. Battery lasts for a long time though, so it might be very rare that you cannot use it because it's charging--just remember to do so while you're away and you'll be good to go.c. As I mentioned, battery life is really good. You can also leave it sleeping without turning it off and nothing bad will happen. I think I charge mine every couple of months, with 3-5 days a week of usage.d. If you want this for gaming, DO NOT BUY, as you have no buttons, scroll wheel, and the sensor is totally tuned for everyday browsing and editing and not for precise movements, and its movement is very assisted (although I'm not sure to what extent that's on MacOS's side).e. About looks, it definitely looks nice both in white and black. Its wireless so it looks nice and elegant.f. On build quality, some units are not on par with the best of Apple's products, but it is still very solid. It definitely doesn't feel cheap although it's definitely pricey for what it does, considering that it hasn't been upgraded in many years.TL;DR: 4/5 stars. Negative: charging port, price. Positive: MacOS gestures, long battery life, looks a feels good."
"May 31, 2022","It's just like I purchased the mouse directly from Apple. It connected easily and works with my MacBook and iPad without issue. The battery life is AMAZING! I've had it for nearly a month and I only had to charge it once. Also, the feel in my hand is amazing. I also love the fact that it doesn't have the wheel but responds to fingers scrolling like on the screen. Totally worth the money I spent on it. I would buy another if I needed it."
"February 24, 2022","Very durable, the weight is good, Functionality is good, value for money, fits perfectly in hand. Thank you."